{"canonical_research_status":"SERVER_CANONICAL_WAITING_QUEUE_IDLE_FUNNEL_READY_ZERO_ACTIVE_ZERO_OOS_2026_08_24T11_57_48Z","classification":{"disposition_actions":[{"action":"COUNT","disposition":"BTC_DAILY_TRAILING365D_DRAWDOWN20_PASSIVE_CORE_HISTORICAL_CANDIDATE_FROZEN_REPORTED_NOT_ACTIVATED"},{"action":"COUNT","disposition":"BTC_DAILY_TRAILING365D_DRAWDOWN20_PASSIVE_CORE_RISK_OVERLAY_FAMILY_CLOSE"},{"action":"EXCLUDE","disposition":"BTC_DAILY_TRAILING365D_DRAWDOWN20_PASSIVE_CORE_EVIDENCE_INSUFFICIENT"}],"duplicate_family_key":"btc-daily-trailing365d-drawdown15-20-25-passive-core-risk-overlay","independence_semantics":"UNIQUE_FAMILY"},"decision_contract":{"insufficient_evidence_disposition":"BTC_DAILY_TRAILING365D_DRAWDOWN20_PASSIVE_CORE_EVIDENCE_INSUFFICIENT","negative_disposition":"BTC_DAILY_TRAILING365D_DRAWDOWN20_PASSIVE_CORE_RISK_OVERLAY_FAMILY_CLOSE","positive_disposition":"BTC_DAILY_TRAILING365D_DRAWDOWN20_PASSIVE_CORE_HISTORICAL_CANDIDATE_FROZEN_REPORTED_NOT_ACTIVATED"},"document_type":"LOCAL_DIRECT_SCREEN_PACKAGE_BLUEPRINT_V1","inputs":[{"kind":"REPOSITORY_PATH","locator":"AGENTS.md","sha256":"AUTO"},{"kind":"REPOSITORY_PATH","locator":".agents/skills/autonomous-trading-research/SKILL.md","sha256":"AUTO"},{"kind":"REPOSITORY_PATH","locator":"docs/autonomous-research-charter.md","sha256":"AUTO"},{"kind":"REPOSITORY_PATH","locator":"docs/local-codex-research-node-v1.md","sha256":"AUTO"},{"kind":"REPOSITORY_PATH","locator":"research_pipeline/policy.v3.json","sha256":"AUTO"},{"kind":"REPOSITORY_PATH","locator":"research_pipeline/local-research-result.schema.json","sha256":"AUTO"},{"kind":"REPOSITORY_PATH","locator":"research_pipeline/local-research-strategy-path.v1.schema.json","sha256":"AUTO"},{"kind":"REPOSITORY_PATH","locator":"research_pipeline/local-direct-screen-package.v1.schema.json","sha256":"AUTO"},{"kind":"REPOSITORY_PATH","locator":"research_pipeline/local_direct_screen_package.py","sha256":"AUTO"},{"kind":"REPOSITORY_PATH","locator":"research_pipeline/examples/local-direct-screen-package.btc-daily-trailing365d-drawdown20-passive-core-v1.json","sha256":"AUTO"},{"kind":"REPOSITORY_PATH","locator":"research_pipeline/examples/btc-daily-trailing365d-drawdown20-passive-core-primary-prior.v1.json","sha256":"AUTO"},{"kind":"REPOSITORY_PATH","locator":"research_pipeline/examples/btc-daily-trailing365d-drawdown20-passive-core-v1.hypothesis.json","sha256":"AUTO"},{"kind":"REPOSITORY_PATH","locator":"research_pipeline/examples/btc-daily-trailing365d-drawdown20-passive-core-risk-overlay-historical.v1.manifest.json","sha256":"AUTO"},{"kind":"REPOSITORY_PATH","locator":"research/btc_daily_trailing365d_drawdown20_passive_core_risk_overlay_historical.py","sha256":"AUTO"},{"kind":"REPOSITORY_PATH","locator":"research/btc_daily_chaikin_money_flow_long_cash_historical.py","sha256":"AUTO"},{"kind":"REPOSITORY_PATH","locator":"research/btc_monthly_30d_volatility_target_40pct_historical.py","sha256":"AUTO"},{"kind":"REPOSITORY_PATH","locator":"research/btc_monthly_12m_time_series_momentum_historical.py","sha256":"AUTO"},{"kind":"REPOSITORY_PATH","locator":"research/btc_dra_reversal_confirmed_exit_v2c.py","sha256":"AUTO"},{"kind":"REPOSITORY_PATH","locator":"research_pipeline/examples/local-research-result.btc-daily-ulcer28-passive-core-risk-overlay-v2.json","sha256":"AUTO"},{"kind":"REPOSITORY_PATH","locator":"research_pipeline/examples/dra-90d-drawdown-recovery-entry-admission.v1.decision.json","sha256":"AUTO"},{"kind":"REPOSITORY_PATH","locator":"research_pipeline/examples/btc-daily-sma200-long-cash-historical.v1.decision.json","sha256":"AUTO"},{"kind":"REPOSITORY_PATH","locator":"research_pipeline/pre-candidate-pool.v1.json","sha256":"AUTO"},{"kind":"SEALED_ARTIFACT","locator":".research-state/java-parity/selection-2019-2024.tsv","sha256":"e436a5a2b093365886464dd3e471cc5cd55c54bd2c06ceaa898ac218c45436dd"},{"kind":"TASK_MESSAGE","locator":"Decision feature: after each complete UTC day, calculate the latest close divided by the maximum close of the latest 365 complete UTC days including current, minus one. A drawdown at or below minus 20 percent is high risk; minus 15 and minus 25 percent are rejection-only neighbors. Execute a changed target only at the next H1 open.","sha256":null},{"kind":"TASK_MESSAGE","locator":"Frozen policy and accounting: hold 100 percent unlevered BTC above the threshold and 50 percent BTC plus 50 percent zero-yield cash at or below it. Compare with full-capital buy-and-hold on the same H1 path, valuation and costs. Design is 2020-2022, Validation is 2023-2024 and annual fair-reset folds are 2020-2024. Normal costs are 10 bps fee plus 5 bps adverse slippage per side; stress costs are 20 plus 10 bps.","sha256":null},{"kind":"TASK_MESSAGE","locator":"Frozen all-pass gates require positive normal and stress returns, at least 70 percent upside capture, Design drawdown at most 90 percent and Validation drawdown at most 85 percent of buy-and-hold, Calmar at least buy-and-hold, sufficient state support, stable rejection-only neighbors, annual breadth, concentration, holding and terminal-inventory quality. Any failure closes the family without tuning.","sha256":null}],"issued_at":{"dispatch":"2026-08-24T13:10:10Z","intent":"2026-08-24T13:10:20Z","strategy_path":"2026-08-24T13:10:30Z","task":"2026-08-24T13:10:00Z"},"limits":{"timeout_seconds":3600},"local_thread_id":"inline-local-node-2026-08-24-trailing365d-drawdown20-v1","manager_thread_id":"019fca63-4f8f-71e3-9d88-297bca468eb9","objective":"Evaluate exactly one frozen BTC daily trailing-365-complete-day drawdown passive-core overlay on the sealed pre-2025 H1 corpus. Compare the primary minus-20-percent high-risk state with rejection-only minus-15 and minus-25-percent neighbors against full-capital buy-and-hold under identical normal and stress costs. Freeze a historical candidate only if every Design, Validation, annual breadth, concentration, holding, terminal and neighbor gate passes; otherwise permanently close the exact family without tuning. This is historical development evidence, not OOS or Trading authorization.","package_id":"btc-daily-trailing365d-drawdown20-passive-core-v1","performance_case":{"causal_mechanism":"A current close at least 20 percent below the highest close in the latest 365 complete UTC days may mark a persistent cumulative-loss state in which retaining only a permanent half-size BTC core reduces subsequent path loss. Recovery above the same threshold restores full exposure without a fitted forecast.","claim_boundary":"This task may establish only one pre-2025 historical Design and Validation decision for trailing-365-day drawdown thresholds of minus 15, 20 and 25 percent and a state-change-only 100/50-percent BTC passive-core policy. It cannot inspect post-2024 data, select a neighbor, tune any formula or gate, activate a strategy or open OOS unless every frozen gate passes.","drawdown_hypothesis":"The primary minus-20-percent state should materially reduce maximum drawdown versus full-capital buy-and-hold while preserving at least 70 percent of upside and improving after-cost Calmar, with annual, threshold-neighbor, holding and terminal-inventory breadth.","expected_direction":"POSITIVE","opportunity_cost":"The overlay may merely reduce exposure after losses, miss rebounds and create a visually smaller but economically inferior path. One frozen matched-capital screen either admits the exact family to independent sealed OOS or closes it before more lookbacks, thresholds and weights consume capacity.","performance_hypothesis":"The trailing-365-day minus-20-percent cumulative-loss state improves after-cost risk-adjusted performance versus full-capital buy-and-hold in both Design and historical Validation, with stable minus-15 and minus-25-percent rejection-only neighbors and broad annual support."},"schema_version":"1","strategy_path":{"candidate_path":{"matched_comparator_id":"FULL_CAPITAL_BTC_BUY_AND_HOLD_SAME_WINDOW_COST_AND_VALUATION","maximum_additional_research_steps":1,"parent_strategy_id":"FULL_CAPITAL_BTC_BUY_AND_HOLD_SAME_WINDOW_COST_AND_VALUATION","positive_next_step":"FROZEN_HYPOTHESIS_MANIFEST","runner_id":"BTC_DAILY_TRAILING365D_DRAWDOWN20_PASSIVE_CORE_RUNNER_V1","status":"DIRECT_TO_FROZEN_HYPOTHESIS"},"decision_time":{"availability_rule":"The latest complete UTC day's close and all 365 closes in the trailing-peak window are known at that day's close. The 100 or 50 percent target is executed only if the state changes, at the H1 open with the same timestamp as that completed daily close; no later price enters the decision.","decision_clock":"COMPLETE_UTC_DAY_CLOSE_BEFORE_NEXT_H1_OPEN","feature_name":"LATEST_COMPLETE_DAY_TRAILING365D_CLOSE_DRAWDOWN_STATE"},"evidence_bindings":{"decision_feature":"research_pipeline/examples/btc-daily-trailing365d-drawdown20-passive-core-risk-overlay-historical.v1.manifest.json","execution_runner":"research/btc_daily_trailing365d_drawdown20_passive_core_risk_overlay_historical.py","matched_comparator":"research_pipeline/examples/btc-daily-trailing365d-drawdown20-passive-core-risk-overlay-historical.v1.manifest.json","parent_strategy":"research_pipeline/examples/btc-daily-trailing365d-drawdown20-passive-core-risk-overlay-historical.v1.manifest.json"}},"task_contract":{"allowed_actions":["READ_FROZEN_REPOSITORY_CONTRACTS","VERIFY_ALL_NON_NULL_INPUT_HASHES","READ_EXACT_SEALED_PRE2025_H1_CORPUS","VALIDATE_H1_AND_TRAILING365D_DAILY_CLOCK_INTEGRITY","RUN_FROZEN_TRAILING365D_DRAWDOWN20_DIRECT_ECONOMIC_RUNNER_TWICE","COMPARE_BYTE_IDENTICAL_RESULTS","EVALUATE_FROZEN_GATE_MATRIX","RETURN_LOCAL_RESEARCH_RESULT"],"expected_outputs":["EXACT_PACKAGE_PREFLIGHT_VALIDATION","SEALED_H1_SOURCE_INTEGRITY","TRAILING365D_DRAWDOWN_DECISION_FEATURE_ACCOUNTING","DESIGN_AND_VALIDATION_LEDGER_MATRIX","ANNUAL_BREADTH_AND_CONCENTRATION","FROZEN_GATE_MATRIX","ONE_TERMINAL_FAMILY_DISPOSITION","MISSING_PROOF_REGISTER","OPPORTUNITY_COST_AND_NEXT_ACTION"],"forbidden_actions":["CANONICAL_STATE_WRITE","SERVER